{
  "schema_version": "v1",
  "request_id": "15151515-1515-4515-8515-151515151515",
  "tenant_id": "11111111-1111-4111-8111-111111111111",
  "workflow_version_id": "14141414-1414-4414-8414-141414141414",
  "action": "approve",
  "notes": "Aprobación humana controlada para esta versión; no sustituye validación legal del caso concreto.",
  "provenance": {
    "credential_id": "33333333-3333-4333-8333-333333333333"
  }
}
